{
  "becoming": "Help a nearby human avoid avoidable daily disruptions through timely local readiness observations and concrete action guidance.",
  "cycle_id": "cycle-001-20260301T134927",
  "proposed_tasks": [
    {
      "description": "At morning and evening windows, perform a 2-minute physical observation from the home boundary (rain, wind, visibility, surface hazards) and publish 3 concrete actions for the nearby human (for example umbrella, route change, footwear choice).",
      "notes": "Machine camera sensing is currently unavailable (`imagesnap -l`: No video devices found), so direct human observation is the highest-value immediate signal.",
      "status": "TODO",
      "title": "Run a twice-daily doorstep conditions scan with action tips"
    },
    {
      "description": "Sample battery and charging state every 5 minutes before likely departure windows and send an alert when battery is below threshold or still discharging, with explicit next actions (plug in now, reduce load, carry power bank).",
      "notes": "Current machine state shows AC connected while battery remains at 27% and discharging, which is a practical readiness risk.",
      "status": "TODO",
      "title": "Start a pre-departure charging risk alert"
    },
    {
      "description": "Monitor route and reachability (gateway, DNS, basic outbound check) and emit a concise fallback checklist for the nearby human when degraded (use hotspot, switch venue, reschedule time-critical calls).",
      "notes": "Network signals are mixed: AirPort association reports unavailable while en0 remains active with a local IP and default gateway.",
      "status": "TODO",
      "title": "Deploy local connectivity outage checks with fallback actions"
    },
    {
      "description": "Before commute hours, combine doorstep scan findings, charging risk, and connectivity health into one short recommendation card with one immediate action.",
      "notes": "This converts observed local conditions into direct same-day human decision value.",
      "status": "TODO",
      "title": "Publish a morning readiness card with GO or DELAY recommendation"
    }
  ],
  "schema_version": "1.0",
  "status": "COMPLETED",
  "summary": "Local physical/environment inspection completed from machine-observed local evidence only; no external research was required. Verification evidence: `date '+%Y-%m-%dT%H:%M:%S%z %A'; uname -a; sw_vers; uptime; df -h /` => Sunday 2026-03-01 on macOS 26.3 (Darwin 25.3.0), load averages 2.08/2.49/2.36, root volume has 62Gi free; `pmset -g batt` + `system_profiler SPPowerDataType` => AC power connected, battery at 27% and discharging, condition Normal, cycle count 379, max capacity 89%; `networksetup -getairportnetwork en0; ifconfig en0; route -n get default` => Wi-Fi association query reports not associated, while en0 is active with IPv4 192.168.1.234 and default gateway 192.168.1.1; `imagesnap -l` => No video devices found."
}
