{
  "artifacts": [
    {
      "description": "Worker result for cycle-001-20260301T010558 containing capability discovery evidence and proposed next tasks.",
      "path": "devices/58f88ed7-929d-4b28-ac18-ba4f59e93a00/runtime/worker_results/cycle-001-20260301T010558.json"
    }
  ],
  "becoming": "Become a reliable autonomous WDIB loop that converts purpose into verified tasks and measurable daily progress.",
  "cycle_id": "cycle-001-20260301T010558",
  "proposed_tasks": [
    {
      "description": "Populate src/SPIRIT.md with a concise becoming statement and 3 measurable outcomes so planning can optimize for explicit goals instead of empty intent.",
      "notes": "Discovery evidence: SPIRIT.md size is 0 bytes and state purpose.becoming is empty.",
      "status": "TODO",
      "title": "Define purpose and measurable outcomes in SPIRIT"
    },
    {
      "description": "Create 3-5 concrete TODO tasks in device state for immediate execution (runtime reliability, schema contract hardening, and purpose tracking) so planner selects non-empty objectives next cycle.",
      "notes": "Discovery evidence: state tasks array is empty, so planner currently falls back to generic self-discovery objective.",
      "status": "TODO",
      "title": "Seed initial task backlog from discovered capabilities"
    },
    {
      "description": "Add a test that executes a controlled tick and asserts work_order and worker_result artifacts are created with schema-valid payloads and expected status transitions.",
      "notes": "Current tests cover prompt, hardware probing, and reducer logic; no end-to-end tick artifact test observed.",
      "status": "TODO",
      "title": "Add integration test for end-to-end tick artifact generation"
    },
    {
      "description": "Implement lightweight cycle diagnostics output (tool versions, command availability, test pass/fail count) as an artifact entry for trend visibility and regression detection.",
      "notes": "This cycle required manual probing; automating snapshot generation will make future capability checks reproducible.",
      "status": "TODO",
      "title": "Capture capability snapshot artifact each cycle"
    }
  ],
  "schema_version": "1.0",
  "status": "COMPLETED",
  "summary": "Capability discovery completed with machine-observed evidence. Commands run: `python3 --version && which python3 && which codex && codex --version` => Python 3.13.5, /usr/bin/python3, /usr/local/bin/codex, codex-cli 0.106.0; `PYTHONPATH=src python3 -m wdib --help` succeeded and listed the `tick` command; `PYTHONPATH=src python3 -m wdib tick --help` succeeded; `PYTHONPATH=src python3 -m unittest discover -s tests -v` => 5 tests ran, 5 passed (test_wdib_codex_prompt, test_wdib_hardware_probe x2, test_wdib_reducer x2). State/context probes: `cat devices/.../state.json` shows becoming empty, tasks=[], hardware_requests=[], incidents=[]; `wc -c src/SPIRIT.md` => 0 (no spirit text yet). Result contract verification: `PYTHONPATH=src python3 -c \"from pathlib import Path; from wdib.contracts import load_json, validate_payload; p=Path('devices/58f88ed7-929d-4b28-ac18-ba4f59e93a00/runtime/worker_results/cycle-001-20260301T010558.json'); payload=load_json(p); validate_payload(payload, 'worker_result.schema.json', label='worker_result'); print('worker_result_schema_valid')\"` => worker_result_schema_valid."
}
