{
  "artifacts": [
    {
      "description": "Worker result for cycle-001-20260301T131405 with machine-observed environment evidence and externally oriented next tasks.",
      "path": "devices/fc2765f6-a873-4348-881a-696bc5632275/runtime/worker_results/cycle-001-20260301T131405.json"
    }
  ],
  "becoming": "Deliver a twice-daily local readiness brief that helps a nearby human make safer, faster day-to-day decisions from observed conditions.",
  "cycle_id": "cycle-001-20260301T131405",
  "proposed_tasks": [
    {
      "description": "At morning and evening, do a 2-minute physical observation from the home boundary (rain, wind, visibility, surface hazards) and publish 3 concrete actions for the nearby human (for example umbrella, route change, footwear choice).",
      "notes": "This adds direct real-world sensing where current on-device telemetry does not capture outdoor conditions.",
      "status": "TODO",
      "title": "Run a twice-daily doorstep observation and action brief"
    },
    {
      "description": "Implement a lightweight monitor that checks link status and local route reachability every 5 minutes, then emits a human-facing alert with fallback actions (hotspot, venue switch, reschedule) when connectivity is degraded.",
      "notes": "Observed network state is mixed (interface active, not associated to AirPort), so explicit reliability checks can prevent avoidable disruptions.",
      "status": "TODO",
      "title": "Start local connectivity outage alerts for schedule protection"
    },
    {
      "description": "Track battery trend when AC is present; if the machine keeps discharging on external power, notify the nearby human to reseat/replace charger before leaving home.",
      "notes": "Current observation shows AC power reported while battery is at 34% and discharging, which can become a real-world failure point.",
      "status": "TODO",
      "title": "Add charging-risk alert tied to real battery behavior"
    },
    {
      "description": "Generate a concise daily card before commute hours combining battery state, charger status, connectivity health, and doorstep observation into GO/DELAY recommendations.",
      "notes": "Uses already-observable local context to create immediate human decision value each day.",
      "status": "TODO",
      "title": "Publish a morning departure readiness card"
    }
  ],
  "schema_version": "1.0",
  "status": "COMPLETED",
  "summary": "Local physical/environment inspection completed from on-device evidence only (no external research). Commands and observations: `date '+%Y-%m-%dT%H:%M:%S%z'; uname -a; sw_vers; uptime` => 2026-03-01T13:15:16+1000 on macOS 26.3 (Darwin 25.3.0), load averages 2.22/2.45/2.94; `pmset -g batt` => \"Now drawing from 'AC Power'\" with battery at 34% and discharging (~1:59 remaining); `system_profiler SPPowerDataType` => charger connected, battery condition Normal, cycle count 379, maximum capacity 89%; `networksetup -getairportnetwork en0` + `ifconfig en0` => not associated with an AirPort network while interface is active with local IPv4/IPv6; `df -h /` => 62Gi available on root volume; `cat devices/fc2765f6-a873-4348-881a-696bc5632275/state.json` and `cat devices/fc2765f6-a873-4348-881a-696bc5632275/public/status.json` => becoming empty, no tasks, no hardware requests, no incidents. Worker result contract verification: `PYTHONPATH=src python3 -c \"from pathlib import Path; from wdib.contracts import load_json, validate_payload; p=Path('devices/fc2765f6-a873-4348-881a-696bc5632275/runtime/worker_results/cycle-001-20260301T131405.json'); payload=load_json(p); validate_payload(payload, 'worker_result.schema.json', label='worker_result'); print('worker_result_schema_valid')\"` => worker_result_schema_valid."
}
